Country,Terrain
Afghanistan ,mostly rugged mountains; plains in north and southwest
Albania ,mostly mountains and hills; small plains along coast
Algeria ,mostly high plateau and desert; some mountains; narrow_ discontinuous coastal plain
American Samoa ,five volcanic islands with rugged peaks and limited coastal plains_ two coral atolls (Rose Island_ Swains Island)
Andorra ,rugged mountains dissected by narrow valleys
Angola ,narrow coastal plain rises abruptly to vast interior plateau
Anguilla ,flat and low-lying island of coral and limestone
Antarctica ,about 98% thick continental ice sheet and 2% barren rock_ with average elevations between 2_000 and 4_000 meters; mountain ranges up to nearly 5_000 meters; ice-free coastal areas include parts of southern Victoria Land_ Wilkes Land_ the Antarctic Peninsula area_ and parts of Ross Island on McMurdo Sound; glaciers form ice shelves along about half of the coastline_ and floating ice shelves constitute 11% of the area of the continent
Antigua and Barbuda ,mostly low-lying limestone and coral islands_ with some higher volcanic areas
Arctic Ocean ,central surface covered by a perennial drifting polar icepack that_ on average_ is about 3 meters thick_ although pressure ridges may be three times that thickness; clockwise drift pattern in the Beaufort Gyral Stream_ but nearly straight-line movement from the New Siberian Islands (Russia) to Denmark Strait (between Greenland and Iceland); the icepack is surrounded by open seas during the summer_ but more than doubles in size during the winter and extends to the encircling landmasses; the ocean floor is about 50% continental shelf (highest percentage of any ocean) with the remainder a central basin interrupted by three submarine ridges (Alpha Cordillera_ Nansen Cordillera_ and Lomonosov Ridge)
Argentina ,rich plains of the Pampas in northern half_ flat to rolling plateau of Patagonia in south_ rugged Andes along western border
Armenia ,Armenian Highland with mountains; little forest land; fast flowing rivers; good soil in Aras River valley
Aruba ,flat with a few hills; scant vegetation
Ashmore and Cartier Islands ,low with sand and coral
Atlantic Ocean ,surface usually covered with sea ice in Labrador Sea_ Denmark Strait_ and coastal portions of the Baltic Sea from October to June; clockwise warm-water gyre (broad_ circular system of currents) in the northern Atlantic_ counterclockwise warm-water gyre in the southern Atlantic; the ocean floor is dominated by the Mid-Atlantic Ridge_ a rugged north-south centerline for the entire Atlantic basin
Australia ,mostly low plateau with deserts; fertile plain in southeast
Austria ,in the west and south mostly mountains (Alps); along the eastern and northern margins mostly flat or gently sloping
Azerbaijan ,large_ flat Kur-Araz Ovaligi (Kura-Araks Lowland_ much of it below sea level) with Great Caucasus Mountains to the north_ Qarabag Yaylasi (Karabakh Upland) in west; Baku lies on Abseron Yasaqligi (Apsheron Peninsula) that juts into Caspian Sea
Bahrain ,mostly low desert plain rising gently to low central escarpment
Baker Island ,low_ nearly level coral island surrounded by a narrow fringing reef
Bangladesh ,mostly flat alluvial plain; hilly in southeast
Barbados ,relatively flat; rises gently to central highland region
Bassas da India ,volcanic rock
Belarus ,generally flat and contains much marshland
Belgium ,flat coastal plains in northwest_ central rolling hills_ rugged mountains of Ardennes Forest in southeast
Belize ,flat_ swampy coastal plain; low mountains in south
Benin ,mostly flat to undulating plain; some hills and low mountains
Bermuda ,low hills separated by fertile depressions
Bhutan ,mostly mountainous with some fertile valleys and savanna
Bolivia ,rugged Andes Mountains with a highland plateau (Altiplano)_ hills_ lowland plains of the Amazon Basin
Bosnia and Herzegovina ,mountains and valleys
Botswana ,predominantly flat to gently rolling tableland; Kalahari Desert in southwest
Bouvet Island ,volcanic; coast is mostly inaccessible
Brazil ,mostly flat to rolling lowlands in north; some plains_ hills_ mountains_ and narrow coastal belt
British Indian Ocean Territory ,flat and low (most areas do not exceed two meters in elevation)
British Virgin Islands ,coral islands relatively flat; volcanic islands steep_ hilly
Brunei ,flat coastal plain rises to mountains in east; hilly lowland in west
Bulgaria ,mostly mountains with lowlands in north and southeast
Burkina Faso ,mostly flat to dissected_ undulating plains; hills in west and southeast
Burma ,central lowlands ringed by steep_ rugged highlands
Burundi ,hilly and mountainous_ dropping to a plateau in east_ some plains
Cambodia ,mostly low_ flat plains; mountains in southwest and north
Cameroon ,diverse_ with coastal plain in southwest_ dissected plateau in center_ mountains in west_ plains in north
Canada ,mostly plains with mountains in west and lowlands in southeast
Cape Verde ,steep_ rugged_ rocky_ volcanic
Cayman Islands ,low-lying limestone base surrounded by coral reefs
Central African Republic ,vast_ flat to rolling_ monotonous plateau; scattered hills in northeast and southwest
Chad ,broad_ arid plains in center_ desert in north_ mountains in northwest_ lowlands in south
Chile ,low coastal mountains; fertile central valley; rugged Andes in east
China ,mostly mountains_ high plateaus_ deserts in west; plains_ deltas_ and hills in east
Christmas Island ,steep cliffs along coast rise abruptly to central plateau
Clipperton Island ,coral atoll
Cocos (Keeling) Islands ,flat_ low-lying coral atolls
Colombia ,flat coastal lowlands_ central highlands_ high Andes Mountains_ eastern lowland plains (Llanos)
Comoros ,volcanic islands_ interiors vary from steep mountains to low hills
"Congo, Republic of the ",coastal plain_ southern basin_ central plateau_ northern basin
Cook Islands ,low coral atolls in north; volcanic_ hilly islands in south
Coral Sea Islands ,sand and coral reefs and islands (or cays)
Costa Rica ,coastal plains separated by rugged mountains including over 100 volcanic cones_ of which several are major volcanoes
Cote d'Ivoire ,mostly flat to undulating plains; mountains in northwest
Croatia ,geographically diverse; flat plains along Hungarian border_ low mountains and highlands near Adriatic coastline and islands
Cuba ,mostly flat to rolling plains_ with rugged hills and mountains in the southeast
Cyprus ,central plain with mountains to north and south; scattered but significant plains along southern coast
Czech Republic ,Bohemia in the west consists of rolling plains_ hills_ and plateaus surrounded by low mountains; Moravia in the east consists of very hilly country
Democratic Republic of the Congo ,vast central basin is a low-lying plateau; mountains in east
Denmark ,low and flat to gently rolling plains
Djibouti ,coastal plain and plateau separated by central mountains
Dominica ,rugged mountains of volcanic origin
Dominican Republic ,rugged highlands and mountains with fertile valleys interspersed
East Timor ,mountainous
Ecuador ,coastal plain (costa)_ inter-Andean central highlands (sierra)_ and flat to rolling eastern jungle (oriente)
Egypt ,vast desert plateau interrupted by Nile valley and delta
El Salvador ,mostly mountains with narrow coastal belt and central plateau
Equatorial Guinea ,coastal plains rise to interior hills; islands are volcanic
Eritrea ,dominated by extension of Ethiopian north-south trending highlands_ descending on the east to a coastal desert plain_ on the northwest to hilly terrain and on the southwest to flat-to-rolling plains
Estonia ,marshy_ lowlands; flat in the north_ hilly in the south
Ethiopia ,high plateau with central mountain range divided by Great Rift Valley
Europa Island ,low and flat
European Union ,fairly flat along the Baltic and Atlantic coast; mountainous in the central and southern areas
Falkland Islands (Islas Malvinas) ,rocky_ hilly_ mountainous with some boggy_ undulating plains
Faroe Islands ,rugged_ rocky_ some low peaks; cliffs along most of coast
Federated States of Micronesia ,islands vary geologically from high mountainous islands to low_ coral atolls; volcanic outcroppings on Pohnpei_ Kosrae_ and Chuuk
Fiji ,mostly mountains of volcanic origin
Finland ,mostly low_ flat to rolling plains interspersed with lakes and low hills
France ,"metropolitan France: mostly flat plains or gently rolling hills in north and west; remainder is mountainous_ especially Pyrenees in south_ Alps in east
French Guiana: low-lying coastal plains rising to hills and small mountains
Guadeloupe: Basse-Terre is volcanic in origin with interior mountains; Grande-Terre is low limestone formation; most of the seven other islands are volcanic in origin
Martinique: mountainous with indented coastline; dormant volcano
Mayotte: generally undulating_ with deep ravines and ancient volcanic peaks
Reunion: mostly rugged and mountainous; fertile lowlands along coast"
French Guiana ,low-lying coastal plains rising to hills and small mountains
French Polynesia ,mixture of rugged high islands and low islands with reefs
French Southern and Antarctic Lands ,"Ile Amsterdam (Ile Amsterdam et Ile Saint-Paul): a volcanic island with steep coastal cliffs; the center floor of the volcano is a large plateau
Ile Saint-Paul (Ile Amsterdam et Ile Saint-Paul): triangular in shape_ the island is the top of a volcano_ rocky with steep cliffs on the eastern side; has active thermal springs
Iles Crozet: a large archipelago formed from the Crozet Plateau is divided into two groups of islands
Iles Kerguelen: the interior of the large island of Ile Kerguelen is composed of rugged terrain of high mountains_ hills_ valleys_ and plains with a number of peninsulas stretching off its coasts
Bassas da India (Iles Eparses): atoll_ awash at high tide; shallow (15 m) lagoon
Europa Island_ Glorioso Islands_ Juan de Nova Island: low_ flat_ and sandy
Tromelin Island (Iles Eparses): low_ flat_ sandy; likely volcanic seamount"
Gabon ,narrow coastal plain; hilly interior; savanna in east and south
Gaza Strip ,flat to rolling_ sand- and dune-covered coastal plain
Georgia ,largely mountainous with Great Caucasus Mountains in the north and Lesser Caucasus Mountains in the south; Kolkhet'is Dablobi (Kolkhida Lowland) opens to the Black Sea in the west; Mtkvari River Basin in the east; good soils in river valley flood plains_ foothills of Kolkhida Lowland
Germany ,lowlands in north_ uplands in center_ Bavarian Alps in south
Ghana ,mostly low plains with dissected plateau in south-central area
Gibraltar ,a narrow coastal lowland borders the Rock of Gibraltar
Glorioso Islands ,low and flat
Greece ,mostly mountains with ranges extending into the sea as peninsulas or chains of islands
Greenland ,flat to gradually sloping icecap covers all but a narrow_ mountainous_ barren_ rocky coast
Grenada ,volcanic in origin with central mountains
Guadeloupe ,Basse-Terre is volcanic in origin with interior mountains; Grande-Terre is low limestone formation; most of the seven other islands are volcanic in origin
Guam ,volcanic origin_ surrounded by coral reefs; relatively flat coralline limestone plateau (source of most fresh water)_ with steep coastal cliffs and narrow coastal plains in north_ low hills in center_ mountains in south
Guatemala ,mostly mountains with narrow coastal plains and rolling limestone plateau
Guernsey ,mostly level with low hills in southwest
Guinea ,generally flat coastal plain_ hilly to mountainous interior
Guinea-Bissau ,mostly low coastal plain rising to savanna in east
Guyana ,mostly rolling highlands; low coastal plain; savanna in south
Haiti ,mostly rough and mountainous
Heard Island and McDonald Islands ,Heard Island - 80% ice-covered_ bleak and mountainous_ dominated by a large massif (Big Ben) and an active volcano (Mawson Peak); McDonald Islands - small and rocky
Holy See (Vatican City) ,urban; low hill
Honduras ,mostly mountains in interior_ narrow coastal plains
Hong Kong ,hilly to mountainous with steep slopes; lowlands in north
Howland Island ,low-lying_ nearly level_ sandy_ coral island surrounded by a narrow fringing reef; depressed central area
Hungary ,mostly flat to rolling plains; hills and low mountains on the Slovakian border
Iceland ,mostly plateau interspersed with mountain peaks_ icefields; coast deeply indented by bays and fiords
India ,upland plain (Deccan Plateau) in south_ flat to rolling plain along the Ganges_ deserts in west_ Himalayas in north
Indian Ocean ,surface dominated by counterclockwise gyre (broad_ circular system of currents) in the southern Indian Ocean; unique reversal of surface currents in the northern Indian Ocean; low atmospheric pressure over southwest Asia from hot_ rising_ summer air results in the southwest monsoon and southwest-to-northeast winds and currents_ while high pressure over northern Asia from cold_ falling_ winter air results in the northeast monsoon and northeast-to-southwest winds and currents; ocean floor is dominated by the Mid-Indian Ocean Ridge and subdivided by the Southeast Indian Ocean Ridge_ Southwest Indian Ocean Ridge_ and Ninetyeast Ridge
Indonesia ,mostly coastal lowlands; larger islands have interior mountains
Iran ,rugged_ mountainous rim; high_ central basin with deserts_ mountains; small_ discontinuous plains along both coasts
Iraq ,mostly broad plains; reedy marshes along Iranian border in south with large flooded areas; mountains along borders with Iran and Turkey
Ireland ,mostly level to rolling interior plain surrounded by rugged hills and low mountains; sea cliffs on west coast
Isle of Man ,hills in north and south bisected by central valley
Israel ,Negev desert in the south; low coastal plain; central mountains; Jordan Rift Valley
Italy ,mostly rugged and mountainous; some plains_ coastal lowlands
Jamaica ,mostly mountains_ with narrow_ discontinuous coastal plain
Jan Mayen ,volcanic island_ partly covered by glaciers
Japan ,mostly rugged and mountainous
Jarvis Island ,sandy_ coral island surrounded by a narrow fringing reef
Jersey ,gently rolling plain with low_ rugged hills along north coast
Johnston Atoll ,mostly flat
Jordan ,mostly desert plateau in east_ highland area in west; Great Rift Valley separates East and West Banks of the Jordan River
Juan de Nova Island ,low and flat
Kazakhstan ,vast flat steppe extending from the Volga in the west to the Altai Mountains in the east and from the plains of western Siberia in the north to oases and deserts of Central Asia in the south
Kenya ,low plains rise to central highlands bisected by Great Rift Valley; fertile plateau in west
Kingman Reef ,low and nearly level
Kiribati ,mostly low-lying coral atolls surrounded by extensive reefs
Kosovo ,flat fluvial basin with an elevation of 400-700 m above sea level surrounded by several high mountain ranges with elevations of 2_000 to 2_500 m
Kuwait ,flat to slightly undulating desert plain
Kyrgyzstan ,peaks of Tien Shan and associated valleys and basins encompass entire nation
Laos ,mostly rugged mountains; some plains and plateaus
Latvia ,low plain
Lebanon ,narrow coastal plain; El Beqaa (Bekaa Valley) separates Lebanon and Anti-Lebanon Mountains
Lesotho ,mostly highland with plateaus_ hills_ and mountains
Liberia ,mostly flat to rolling coastal plains rising to rolling plateau and low mountains in northeast
Libya ,mostly barren_ flat to undulating plains_ plateaus_ depressions
Liechtenstein ,mostly mountainous (Alps) with Rhine Valley in western third
Lithuania ,lowland_ many scattered small lakes_ fertile soil
Luxembourg ,mostly gently rolling uplands with broad_ shallow valleys; uplands to slightly mountainous in the north; steep slope down to Moselle flood plain in the southeast
Macau ,generally flat
Madagascar ,narrow coastal plain_ high plateau and mountains in center
Malawi ,narrow elongated plateau with rolling plains_ rounded hills_ some mountains
Malaysia ,coastal plains rising to hills and mountains
Maldives ,flat_ with white sandy beaches
Mali ,mostly flat to rolling northern plains covered by sand; savanna in south_ rugged hills in northeast
Malta ,mostly low_ rocky_ flat to dissected plains; many coastal cliffs
Marshall Islands ,low coral limestone and sand islands
Martinique ,mountainous with indented coastline; dormant volcano
Mauritania ,mostly barren_ flat plains of the Sahara; some central hills
Mauritius ,small coastal plain rising to discontinuous mountains encircling central plateau
Mayotte ,generally undulating_ with deep ravines and ancient volcanic peaks
Mexico ,high_ rugged mountains; low coastal plains; high plateaus; desert
Midway Islands ,low_ nearly level
Moldova ,rolling steppe_ gradual slope south to Black Sea
Monaco ,hilly_ rugged_ rocky
Mongolia ,vast semidesert and desert plains_ grassy steppe_ mountains in west and southwest; Gobi Desert in south-central
Montenegro ,highly indented coastline with narrow coastal plain backed by rugged high limestone mountains and plateaus
Montserrat ,volcanic island_ mostly mountainous_ with small coastal lowland
Morocco ,northern coast and interior are mountainous with large areas of bordering plateaus_ intermontane valleys_ and rich coastal plains
Mozambique ,mostly coastal lowlands_ uplands in center_ high plateaus in northwest_ mountains in west
Namibia ,mostly high plateau; Namib Desert along coast; Kalahari Desert in east
Nauru ,sandy beach rises to fertile ring around raised coral reefs with phosphate plateau in center
Navassa Island ,raised coral and limestone plateau_ flat to undulating; ringed by vertical white cliffs (9 to 15 m high)
Nepal ,Tarai or flat river plain of the Ganges in south_ central hill region_ rugged Himalayas in north
Netherlands ,mostly coastal lowland and reclaimed land (polders); some hills in southeast
Netherlands Antilles ,generally hilly_ volcanic interiors
New Caledonia ,coastal plains with interior mountains
New Zealand ,predominately mountainous with some large coastal plains
Nicaragua ,extensive Atlantic coastal plains rising to central interior mountains; narrow Pacific coastal plain interrupted by volcanoes
Niger ,predominately desert plains and sand dunes; flat to rolling plains in south; hills in north
Nigeria ,southern lowlands merge into central hills and plateaus; mountains in southeast_ plains in north
Niue ,steep limestone cliffs along coast_ central plateau
Norfolk Island ,volcanic formation with mostly rolling plains
North Korea ,mostly hills and mountains separated by deep_ narrow valleys; coastal plains wide in west_ discontinuous in east
Northern Mariana Islands ,southern islands are limestone with level terraces and fringing coral reefs; northern islands are volcanic
Norway ,glaciated; mostly high plateaus and rugged mountains broken by fertile valleys; small_ scattered plains; coastline deeply indented by fjords; arctic tundra in north
Oman ,central desert plain_ rugged mountains in north and south
Pacific Ocean ,surface currents in the northern Pacific are dominated by a clockwise_ warm-water gyre (broad circular system of currents) and in the southern Pacific by a counterclockwise_ cool-water gyre; in the northern Pacific_ sea ice forms in the Bering Sea and Sea of Okhotsk in winter; in the southern Pacific_ sea ice from Antarctica reaches its northernmost extent in October; the ocean floor in the eastern Pacific is dominated by the East Pacific Rise_ while the western Pacific is dissected by deep trenches_ including the Mariana Trench_ which is the world's deepest
Pakistan ,flat Indus plain in east; mountains in north and northwest; Balochistan plateau in west
Palau ,varying geologically from the high_ mountainous main island of Babelthuap to low_ coral islands usually fringed by large barrier reefs
Palmyra Atoll ,very low
Panama ,interior mostly steep_ rugged mountains and dissected_ upland plains; coastal areas largely plains and rolling hills
Papua New Guinea ,mostly mountains with coastal lowlands and rolling foothills
Paracel Islands ,mostly low and flat
Paraguay ,grassy plains and wooded hills east of Rio Paraguay; Gran Chaco region west of Rio Paraguay mostly low_ marshy plain near the river_ and dry forest and thorny scrub elsewhere
Peru ,western coastal plain (costa)_ high and rugged Andes in center (sierra)_ eastern lowland jungle of Amazon Basin (selva)
Philippines ,mostly mountains with narrow to extensive coastal lowlands
Pitcairn Islands ,rugged volcanic formation; rocky coastline with cliffs
Poland ,mostly flat plain; mountains along southern border
Portugal ,mountainous north of the Tagus River_ rolling plains in south
Puerto Rico ,mostly mountains with coastal plain belt in north; mountains precipitous to sea on west coast; sandy beaches along most coastal areas
Qatar ,mostly flat and barren desert covered with loose sand and gravel
Republic of Macedonia ,mountainous territory covered with deep basins and valleys; three large lakes_ each divided by a frontier line; country bisected by the Vardar River
Reunion ,mostly rugged and mountainous; fertile lowlands along coast
Romania ,central Transylvanian Basin is separated from the Moldavian Plateau on the east by the Eastern Carpathian Mountains and separated from the Walachian Plain on the south by the Transylvanian Alps
Russia ,broad plain with low hills west of Urals; vast coniferous forest and tundra in Siberia; uplands and mountains along southern border regions
Rwanda ,mostly grassy uplands and hills; relief is mountainous with altitude declining from west to east
Saint Barthelemy ,hilly_ almost completely surrounded by shallow-water reefs_ with plentiful beaches
Saint Helena ,"the islands of this group result from volcanic activity associated with the Atlantic Mid-Ocean Ridge
Saint Helena: rugged_ volcanic; small scattered plateaus and plains
Ascension: surface covered by lava flows and cinder cones of 44 dormant volcanoes; ground rises to the east
Tristan da Cunha: sheer cliffs line the coastline of the nearly circular island; the flanks of the central volcanic peak are deeply dissected; narrow coastal plain lies between The Peak and the coastal cliffs"
"Saint Helena, Ascension, and Tristan da Cunha ","the islands of this group result from volcanic activity associated with the Atlantic Mid-Ocean Ridge
Saint Helena: rugged_ volcanic; small scattered plateaus and plains
Ascension: surface covered by lava flows and cinder cones of 44 dormant volcanoes; ground rises to the east
Tristan da Cunha: sheer cliffs line the coastline of the nearly circular island; the flanks of the central volcanic peak are deeply dissected; narrow coastal plain lies between The Peak and the coastal cliffs"
Saint Kitts and Nevis ,volcanic with mountainous interiors
Saint Lucia ,volcanic and mountainous with some broad_ fertile valleys
Saint Pierre and Miquelon ,mostly barren rock
Saint Vincent and the Grenadines ,volcanic_ mountainous
Samoa ,two main islands (Savaii_ Upolu) and several smaller islands and uninhabited islets; narrow coastal plain with volcanic_ rocky_ rugged mountains in interior
San Marino ,rugged mountains
Sao Tome and Principe ,volcanic_ mountainous
Saudi Arabia ,mostly uninhabited_ sandy desert
Senegal ,generally low_ rolling_ plains rising to foothills in southeast
Serbia ,extremely varied; to the north_ rich fertile plains; to the east_ limestone ranges and basins; to the southeast_ ancient mountains and hills
Serbia and Montenegro ,extremely varied; to the north_ rich fertile plains; to the east_ limestone ranges and basins; to the southeast_ ancient mountains and hills
Seychelles ,Mahe Group is granitic_ narrow coastal strip_ rocky_ hilly; others are coral_ flat_ elevated reefs
Sierra Leone ,coastal belt of mangrove swamps_ wooded hill country_ upland plateau_ mountains in east
Singapore ,lowland; gently undulating central plateau contains water catchment area and nature preserve
Slovakia ,rugged mountains in the central and northern part and lowlands in the south
Slovenia ,a short coastal strip on the Adriatic_ an alpine mountain region adjacent to Italy and Austria_ mixed mountains and valleys with numerous rivers to the east
Solomon Islands ,mostly rugged mountains with some low coral atolls
Somalia ,mostly flat to undulating plateau rising to hills in north
South Africa ,vast interior plateau rimmed by rugged hills and narrow coastal plain
South Georgia and the South Sandwich Islands ,most of the islands_ rising steeply from the sea_ are rugged and mountainous; South Georgia is largely barren and has steep_ glacier-covered mountains; the South Sandwich Islands are of volcanic origin with some active volcanoes
South Korea ,mostly hills and mountains; wide coastal plains in west and south
South Sudan ,the terrain gradually rises from plains in the north and center to southern highlands along the border with Uganda and Kenya; the White Nile_ flowing north out of the uplands of Central Africa_ is the major geographic feature of the country supporting agriculture and extensive wild animal populations; The Sudd (a name derived from floating vegetation that hinders navigation) is a large swampy area of more than 100_000 sq km fed by the waters of the White Nile that dominates the center of the country
