Country,Terrain
Southern Ocean ,the Southern Ocean is deep_ 4_000 to 5_000 m over most of its extent with only limited areas of shallow water; the Antarctic continental shelf is generally narrow and unusually deep_ its edge lying at depths of 400 to 800 m (the global mean is 133 m); the Antarctic icepack grows from an average minimum of 2.6 million sq km in March to about 18.8 million sq km in September_ better than a sixfold increase in area; the Antarctic Circumpolar Current (21_000 km in length) moves perpetually eastward; it is the world's largest ocean current_ transporting 130 million cubic meters of water per second - 100 times the flow of all the world's rivers
Spain ,large_ flat to dissected plateau surrounded by rugged hills; Pyrenees Mountains in north
Spratly Islands ,flat
Sri Lanka ,mostly low_ flat to rolling plain; mountains in south-central interior
Sudan ,generally flat_ featureless plain; desert dominates the north
Suriname ,mostly rolling hills; narrow coastal plain with swamps
Svalbard ,wild_ rugged mountains; much of high land ice covered; west coast clear of ice about one-half of the year; fjords along west and north coasts
Swaziland ,mostly mountains and hills; some moderately sloping plains
Sweden ,mostly flat or gently rolling lowlands; mountains in west
Switzerland ,mostly mountains (Alps in south_ Jura in northwest) with a central plateau of rolling hills_ plains_ and large lakes
Syria ,primarily semiarid and desert plateau; narrow coastal plain; mountains in west
Taiwan ,eastern two-thirds mostly rugged mountains; flat to gently rolling plains in west
Tajikistan ,Pamir and Alay Mountains dominate landscape; western Fergana Valley in north_ Kofarnihon and Vakhsh Valleys in southwest
Tanzania ,plains along coast; central plateau; highlands in north_ south
Thailand ,central plain; Khorat Plateau in the east; mountains elsewhere
The Bahamas ,long_ flat coral formations with some low rounded hills
The Gambia ,flood plain of the Gambia River flanked by some low hills
Togo ,gently rolling savanna in north; central hills; southern plateau; low coastal plain with extensive lagoons and marshes
Tokelau ,low-lying coral atolls enclosing large lagoons
Tonga ,most islands have limestone base formed from uplifted coral formation; others have limestone overlying volcanic base
Trinidad and Tobago ,mostly plains with some hills and low mountains
Tromelin Island ,low_ flat_ and sandy; likely volcanic
Tunisia ,mountains in north; hot_ dry central plain; semiarid south merges into the Sahara
Turkey ,high central plateau (Anatolia); narrow coastal plain; several mountain ranges
Turkmenistan ,flat-to-rolling sandy desert with dunes rising to mountains in the south; low mountains along border with Iran; borders Caspian Sea in west
Turks and Caicos Islands ,low_ flat limestone; extensive marshes and mangrove swamps
Tuvalu ,low-lying and narrow coral atolls
Uganda ,mostly plateau with rim of mountains
Ukraine ,most of Ukraine consists of fertile plains (steppes) and plateaus_ mountains being found only in the west (the Carpathians)_ and in the Crimean Peninsula in the extreme south
United Arab Emirates ,flat_ barren coastal plain merging into rolling sand dunes of vast desert wasteland; mountains in east
United Kingdom ,mostly rugged hills and low mountains; level to rolling plains in east and southeast
United States ,vast central plain_ mountains in west_ hills and low mountains in east; rugged mountains and broad river valleys in Alaska; rugged_ volcanic topography in Hawaii
Uruguay ,mostly rolling plains and low hills; fertile coastal lowland
Uzbekistan ,mostly flat-to-rolling sandy desert with dunes; broad_ flat intensely irrigated river valleys along course of Amu Darya_ Syr Darya (Sirdaryo)_ and Zarafshon; Fergana Valley in east surrounded by mountainous Tajikistan and Kyrgyzstan; shrinking Aral Sea in west
Vanuatu ,mostly mountainous islands of volcanic origin; narrow coastal plains
Venezuela ,Andes Mountains and Maracaibo Lowlands in northwest; central plains (llanos); Guiana Highlands in southeast
Vietnam ,low_ flat delta in south and north; central highlands; hilly_ mountainous in far north and northwest
Virgin Islands ,mostly hilly to rugged and mountainous with little level land
Wake Island ,atoll of three low coral islands_ Peale_ Wake_ and Wilkes_ built up on an underwater volcano; central lagoon is former crater_ islands are part of the rim
Wallis and Futuna ,volcanic origin; low hills
West Bank ,mostly rugged dissected upland_ some vegetation in west_ but barren in east
Western Sahara ,mostly low_ flat desert with large areas of rocky or sandy surfaces rising to small mountains in south and northeast
Yemen ,narrow coastal plain backed by flat-topped hills and rugged mountains; dissected upland desert plains in center slope into the desert interior of the Arabian Peninsula
Zambia ,mostly high plateau with some hills and mountains
Zimbabwe ,mostly high plateau with higher central plateau (high veld); mountains in east
